{
 "schema_version": 1,
 "at": "2026-10-28T12:19:26Z",
 "desk": "solada",
 "note": "Research vetoes for the Cardano desk. Never a buy signal. They do not change desk rules, kill lines, or thresholds. Evidence values are wallet tags only.",
 "buy_signal": false,
 "sources": [
  "dev_checks",
  "liquidity_moves"
 ],
 "stale": [],
 "tokens": []
}